{
  "$schema": "../../../../schemas/lesson.schema.json",
  "lessonId": "lesson-20260713-runtime-ag-os-compounding-completion-20260713-02",
  "title": "Preserve recommendations from quality-score-20260713-runtime-ag-os-compounding-completion-20260713",
  "lesson": "Quality score recommendations should become candidate planning reminders, not automatic memory truth. First recommendation: Improve performance evidence before promotion beyond plan-only work.",
  "sources": [
    ".codex/quality-scores/quality-score-20260713-runtime-ag-os-compounding-completion-20260713.json",
    ".codex/plans/plan-runtime-ag-os-compounding-completion-20260713.json",
    ".codex/execution/exec-runtime-ag-os-compounding-completion-20260713-run-validation.json"
  ],
  "scope": "agent_shared",
  "confidence": "medium",
  "status": "candidate",
  "owner": "owner-gurnoor-bassi",
  "projectId": "project-ag-os-coordinator-runtime",
  "appliesTo": [
    "archetype-dashboard",
    "plan_quality_score",
    "quality-score-lesson-loop"
  ],
  "sourceScoreId": "quality-score-20260713-runtime-ag-os-compounding-completion-20260713",
  "generatedBy": "scripts/process-lesson-candidates.mjs",
  "whyThisMatters": "Recommendations are useful only when source-linked and owner-reviewable.",
  "whenToUse": "Use when a source-controlled quality score includes concrete improvement recommendations.",
  "whenNotToUse": "Do not use when the recommendation is vague, unsourced, sensitive, or conflicts with AG OS safety gates.",
  "notes": "Candidate only. Not accepted truth until owner-reviewed and promoted through the memory learning policy.",
  "createdAt": "2026-07-13T09:23:19.817Z",
  "updatedAt": "2026-07-13T09:23:19.817Z"
}
